clinical_question,bottom_line,link_name,,
In patients at high risk for CV disease does a Mediterranean diet enriched with extra-virgin olive oil or nuts reduce MI CVA or CV death compared to a low-fat diet?,"'Epidemiologic trials from the 1960s suggested that a so-called ""Mediterranean diet"" rich in fresh fruits vegetables fish olive oil and wine was associated with decreased rates of CV disease.[1] Multiple studies have demonstrated a mortality benefit from a Mediterranean or Mediterranean-like diet after MI including DART (1989)[2] and the Cardioprotective Diet Study (1992).[3] Most recently the Lyon Diet Heart Study (1999)[4] demonstrated that a Mediterranean diet reduced recurrent CV events by 50-70% among MI patients.[5] The role of the Mediterranean diet in primary prevention of CV disease hadn''t been well established.'",/wiki/PREDIMED,,
In patients with severe alcoholic hepatitis does prednisolone improve survival?,Alcoholic hepatitis carries up to a 65% mortality rate and because therapy generally has consisted mainly of supportive measures many investigators have sought out disease-modifying interventions. In a sea of studies yielding conflicting results the present 1992 study was one of the first to suggest a survival benefit of glucocorticoids among patients with severe alcoholic hepatitis.,/wiki/Prednisolone_in_Severe_Alcoholic_Hepatitis,,
In patients with acute proximal DVT does routine IVC filter placement in addition to anticoagulation reduce the short-term incidence of acute pulmonary embolism?,Inferior vena cava (IVC) filters sit within the inferior vena cava to mechanically prevent the translocation of thrombus from the lower extremity deep veins to the pulmonary vessels which would otherwise result in a pulmonary embolism (PE). The role of IVC filters in acute venous thromboembolic (VTE) disease is often unclear and rigorously debated. Given the well known efficacy of anticoagulation and the relative invasiveness of IVC filter placement early IVC filters were usually reserved for patients with contraindications to or failure of anticoagulant therapy. But in the late 1990s routine IVC filter placement became increasingly common in the wake of newer devices that could be placed percutaneously with relatively low complication rates.[1] Whether this increase in IVC filter placement yielded meaningful clinical benefits was unclear given the lack of randomized trial data. ,/wiki/PREPIC,,
In patients with acute pulmonary embolism and a high risk of recurrence does the addition of an IVC filter to anticoagulation alone reduce the risk of symptomatic recurrent pulmonary embolism?,Despite therapeutic anticoagulation some patients with acute VTE experience recurrent events and IVC filters have been theorized to reduce recurrence. The initial PREPIC study (1998) demonstrated that among patients with acute proximal DVT permanent IVC filter placement reduced the rate of recurrent PE but markedly increased rates of DVT compared to anticoagulation alone and had no impact on overall survival.[1] Consequently standard practice is to offer IVC filters only to patients with contraindications to anticoagulation. PREPIC 2 sought to identify a subpopulation of patients with acute VTE in whom the risk of early recurrence was so great that perhaps temporary placement of a retrievable IVC filter may improve clinical outcomes compared to standard anticoagulation alone.,/wiki/PREPIC_2,,
In patients with nonvalvular atrial fibrillation how does the safety and efficacy of the Watchman left atrial appendage closure device compare with long-term warfarin therapy for stroke prevention?,PROTECT AF showed that the Watchman LAA closure device was noninferior to warfarin for stroke prevention in patients with nonvalvular atrial fibrillation (NVAF) but a periprocedural safety hazard was identified. The PREVAIL study was designed to provide additional information on the safety and efficacy of the LAA closure technology. PREVAIL randomized an additional 407 patients with nonvalvular AF in a 2:1 fashion to either LAA closure with the Watchman device or to a control arm which received antithrombotic therapy alone. The analysis was an intention-to-treat noninferiority analysis studying short- and long-term efficacy and safety outcomes. The first efficacy outcome a composite of stroke systemic embolism or cardiovascular/unexplained death did not meet the noninferiority criterion. Noninferiority was achieved with the other two outcomes namely the rate of late ischemic events (after 7 days of randomization) and the rate of early ischemic events and device/procedural complications (within 7 days of procedure). The authors conclude that LAA closure with the Watchman device may be appropriate for selected patients. Guidelines issued in 2019 recommend consideration of LAA closure for patients who are not candidates for long-term anticoagulation although PREVAIL did not study such a population. ,/wiki/PREVAIL,,
Among patients with latent TB is a more convenient regimen of 3 months of rifapentine plus isoniazid noninferior to the standard-of-care 9 months of isoniazid?,Isoniazid (INH) for 9 months under direct observation is a common treatment for latent TB. This regimen is 60-90% effective in reducing the rate of active TB but compliance is suboptimal owing to the long duration of therapy and to its adverse effects most notably hepatotoxicity. Many studies have thus evaluated alternative antibiotic regimens with shorter duration of therapy; these include 4 months of rifampin and 3 months of combined rifampin plus INH.,/wiki/PREVENT_TB,,
Among patients with early septic shock is early goal-directed therapy or a novel protocol-based therapy superior to usual care in reducing all-cause in-hospital mortality at 60 days?,A dramatic shift in the practice of critical care medicine followed the publication of the 2001 Rivers Trial a single urban-center trial demonstrating that an early goal-directed therapy (EGDT) protocol featuring aggressive resuscitation and early antibiotics led to an absolute risk reduction in mortality of 16% for patients with severe sepsis or septic shock. Resuscitation involved administration of fluids vasopressors and packed RBC transfusions guided by MAP CVP ScvO2 (which required central line placement) and UOP in the first 6 hours. The following year the international Surviving Sepsis Campaign (SSC) was established to promote evidence-based approaches for reducing mortality from sepsis;[1] its guidelines reflect the EGDT protocol with a grade 1C recommendation.[2] Institutions implementing EGDT-like strategies have reported mortality reductions.[3],/wiki/ProCESS,,
Among fit patients with untreated metastatic pancreatic adenocarcinoma does FOLFIRINOX prolong overall survival compared to gemcitabine alone?,Pancreatic cancer is a devastating disease especially for the 52% of patients who have metastatic disease at the time of diagnosis.[1]  For years patients with advanced pancreatic cancer were treated with gemcitabine monotherapy based on a trial published by Burris and colleagues that demonstrated a survival benefit of gemcitabine over bolus fluorouracil (5.65 vs. 4.41 months P=0.0025).[2] Many trials attempted to combine gemcitabine with another agent to further improve survival. Meta-analyses of trials with gemcitabine combinations in advanced pancreatic cancer failed to show significantly improved survival compared to gemcitabine alone.[3] [4] The combination of erlotinib and gemcitabine was shown to be statistically superior to gemctiabine alone and led to the FDA approval of erlotinib for patients with advanced pancreatic cancer.[5] However this amounted to a survival benefit of only 0.33 months (6.24 vs. 5.91 months HR 0.82 95% CI 0.69-0.99 P=0.38) so this combination is not used in practice.[6]  More recently the 2013 Metastatic Pancreatic Adenocarcinoma Clinical Trial (MPACT) evaluated the addition of nab-paclitaxel to gemcitabine. Nab-paclitaxel plus gemcitabine did significantly improve overall survival over gemcitabine alone (8.5 vs. 6.7 months P<0.001) and this combination is a viable treatment option for patients with metastatic pancreatic cancer. [7][8],/wiki/PRODIGE_4_ACCORD_11,,
Among patients with a recent ischemic stroke how does combination aspirin-dipyridamole compare to clopidogrel in preventing recurrent stroke?,'Aspirin''s efficacy in the secondary prevention of ischemic stroke was best demonstrated in the 2002 Antithrombotic Trialists'' Collaboration meta-analysis.[1] Randomized trials of other antiplatelet agents namely clopidogrel and combination aspirin-dipyridamole showed that perhaps greater benefits would be seen with alternative agents. For example CAPRIE demonstrated clopidogrel''s superiority over aspirin at reducing cardiovascular events and ESPS-2 and ESPRIT demonstrated that combination aspirin-dipyridamole outperformed aspirin in secondary prevention of ischemic stroke. PRoFESS sought to determine whether these alternative antiplatelet therapies would perform similarly in reducing recurrent ischemic strokes. ',/wiki/PRoFESS,,
Among patients with unprovoked VTE does the end-of-treatment D-dimer level predict for future thrombosis and allow for tailored therapy?,Unprovoked VTE is associated with a high rate of recurrent VTE such that approximately one third of such patients will develop a recurrence within the 5 years after stopping anticoagulation. A number of studies have therefore evaluated the role of extended anticoagulation in patients with unprovoked VTE including AMPLIFY-EXT and EINSTEIN CHOICE. But whether all patients with unprovoked VTE require indefinite anticoagulation is not known. Efforts are therefore underway to generate clinical and laboratory risk assessment tools for determining who is at the highest risk of recurrence and tailoring therapy accordingly. The D-dimer assay which directly measures the byproducts of thrombus formation is an attractive candidate marker the hypothesis being that patients with unprovoked VTE who have an elevated D-dimer after anticoagulation therapy may have a higher risk of recurrent VTE in the future. This had been demonstrated previously[1] but a prospective randomized trial was necessary.,/wiki/PROLONG,,
In patients with severe sepsis and septic shock does early goal-directed therapy reduce mortality compared to standard therapy in a multicenter trial?,'The Rivers Trial (2001) demonstrated a 16% absolute mortality reduction in severe sepsis and septic shock with the implementation of a specific goal-oriented resuscitation protocol which subsequently became known as early goal-directed therapy (EGDT). At its most basic EGDT dictates a series of CVP MAP and ScvO2 thresholds to target with the use of fluid boluses vasopressors and inotropes and transfusions. As a result of the survival benefit seen in the Rivers study EGDT quickly became implemented into the Surviving Sepsis Guidelines and thus became standard of care in the treatment of sepsis. Given the study''s limited sample size (N=263) and single-center design physicians and investigators called into question the reproducibility of the findings. Thus three concurrent randomized trials were undertaken to verify the results of the Rivers trial and confirm the benefits of EGDT in a broader patient population. Two of these trials ProCESS in the United States and ARISE in Australia failed to reproduce the findings of the Rivers Trial showing no benefit to EGDT over the standard of care. The major criticism of these trials was a lower-than-expected baseline mortality rate of ~20% at 60 to 90 days which limited power to detect a benefit of EGDT in these patients. Investigators called for additional randomized studies on the basis of these and other concerns.',/wiki/ProMISe,,
In critically ill ICU patients with suspected bacterial infections what is the benefit of a procalcitonin-guided strategy on mortality and antibiotic-free days?,Prolonged courses of antibiotics increase selective pressure in a population of bacteria to allow resistant bacteria to thrive and exposure of bacteria to suboptimal antibiotic concentrations increases the frequency of antibiotic resistant organisms.  As a result antimicrobial resistance has emerged as a public health issue of increasing magnitude and finding effective solutions to address this problem is a critical focus of the CDC.,/wiki/PRORATA,,
Among patients with severe ARDS does prone positioning reduce all-cause mortality at 28 days when compared to supine-only positioning?,Acute respiratory distress syndrome (ARDS) is associated with a high mortality and prolonged periods of intubation. While some ground was gained through low tidal volume (Vt) ventilation (ARDSNet; 2000) low fluid volume (FACTT; 2006) and therapeutic paralysis (ACURASYS; 2010) the mortality approaches 25% even in the era of these and other lung-protective strategies.[1] Prone positioning which seems to improve ventilation-perfusion matching through aeration of previously atelectatic dependent alveoli has been shown in unblinded studies to improve survival particularly when used as rescue therapy in severe ARDS (ie P:F <100 mmHg). While this finding was corroborated in a 2010 meta-analysis of seven well-designed randomized trials in severe ARDS[2] a large randomized trial was lacking.,/wiki/PROSEVA,,
Among patients with non-valvular atrial fibrillation is percutaneous left atrial appendage closure with the WATCHMAN device non-inferior to warfarin for the prevention of vascular events?,It is estimated that only 50% of patients with non-valvular atrial fibrillation who qualify for warfarin are actually treated.[1] This is a concern as the annual risk of stroke among those who are not anticoagulated range from 1.5% in individuals aged 50–59 years to 23.5% for those aged 80–89 years.[2] Alternatives to anticoagulation have thus been pursued. One strategy involves obliteration of the left atrial appendage (LAA) since this site is a common location of clot formation in non-valvular AF. ,/wiki/PROTECT_AF,,
Among patients with recent ACS does high-dose atorvastatin reduce the rate of CV events compared to moderate-dose pravastatin?,The Pravastatin or Atorvastatin Evaluation and Infection Therapy–Thrombolysis in Myocardial Infarction 22 (PROVE IT-TIMI 22) trial published in 2004 randomized 4162 patients with recent ACS to high-dose atorvastatin 80mg daily or moderate-dose pravastatin 40mg daily. Using non-inferiority analysis at a mean follow-up of 2 years the high-dose atorvastatin group was associated with a reduction in the composite endpoint of death MI UA requiring hospitalization revascularization at ≥30 days or stroke (22.4% vs. 26.3%). Atorvastatin was associated with a significantly reduced LDL (62 vs. 95 mg/dL) and a nonsignificant reduction in mortality compared to pravastatin (2.2% vs. 3.2%). There were no differences in rates of drug discontinuation due to myalgias elevated CPK or rhabdomyolysis.,/wiki/PROVE_IT-TIMI_22,,
Among patients with severe sepsis does activated protein C improve survival?,The end-organ dysfunction that accompanies severe sepsis and septic shock is in part mediated by a systemic proinflammatory and procoagulant state leading to the hypothesis that recombinant human activated protein C (drotrecogin alfa DrotAA) may improve survival when administered to adults with severe sepsis.,/wiki/PROWESS,,
Among patients with septic shock does activated protein C decrease mortality?,The end-organ dysfunction that accompanies severe sepsis and septic shock is in part mediated by a systemic proinflammatory and procoagulant state. Since activated protein C promotes fibrinolysis and inhibits thrombosis it was hypothesized that recombinant human activated protein C (drotrecogin alfa DrotAA) may improve survival when administered to patients with severe sepsis. This was initially tested in the 2001 PROWESS trial which demonstrated a survival benefit among patients with severe sepsis randomized to DrotAA (28-day mortality of 24.7% vs. 30.8% with placebo). Subgroup analyses suggested the greatest benefit occurred in patients with a high risk of death (ie APACHE II scores ≥25).[1][2][3] As a result the FDA approved DrotAA for use only in patients with severe sepsis and a high risk of death and requested further studies to evaluate DrotAA among less critically ill patients.,/wiki/PROWESS-SHOCK,,
In non-critically ill inpatients with type 2 diabetes mellitus who were insulin-naive is a basal-bolus insulin regimen more effective and safer for glycemic control as compared to sliding-scale regular insulin?,Poor glycemic control is associated with worse outcomes in critical and non-critically ill patients with diabetes mellitus (DM).[1][2] At the time of the trial the optimal management strategy for glycemic control of hospitalized patients was unclear. Although sliding-scale insulin (SSI) was widely used there are significant disadvantages associated with this reactive strategy which attempts to treat rather than prevent hyperglycemia. Queale et al. reported that SSI is associated with a 3-fold increase in the risk of hyperglycemia as compared to patients not receiving glycemic therapy.[3] In children admitted for diabetic ketoacidosis SSI was associated with a longer duration of ketoacidosis and length of stay.[4],/wiki/RABBIT_2,,
Among patients with permanent atrial fibrillation what is the effect of lenient compared to strict rate control strategies on cardiovascular events?,AFFIRM (2002) suggested a mortality benefit in management of AF with rate control over rhythm control. The 2010 Rate Control Efficacy in Permanent Atrial Fibrillation: a Comparison between Lenient versus Strict Rate Control II (RACE II) trial directly addressed the issue of optimal rate control for patients with permanent AF and found that a lenient rate control strategy (resting HR <110 bpm) was noninferior to a strict rate control strategy (resting HR <80 bpm and HR during moderate exercise <110 bpm) in preventing the composite outcome of CV death CHF hospitalization stroke systemic embolism bleeding and life threatening arrhythmic events over 3 years.  ,/wiki/RACE_II,,
In patients with non-traumatic low pain back does rapid MRI compared with conventional radiography for diagnosis decrease back pain-related disability patient perception of pain or health care costs?,Low back pain is a common office complaint in both primary care physician clinics. In one study approximately 8% of American adults reported at least 1 episode of severe acute low back pain within a one year period.[1] The prognosis is generally good with a majority of patients improving with conservative management. Pain and disability often rapidly improves within the first month with a return to work rate of 82% for those initially off work and further improvements up to three months.[2] Clinicians are therefore faced with the decision to image or to empirically provide supportive care with analgesics and physical therapy. In those undergoing imaging plain film radiographs have frequently been employed but the diagnostic yield is low in patients with acute non-traumatic low back pain. With advancements in MRI technology rapid MRIs for lumbar spine have made it a potentially viable option as the initial imaging modality in patients with lower back pain. The excellent soft tissue resolution allows for better identifications of structural abnormalities which may or may not be symptomatic. While MRI may improve upon the diagnostic yield compared to plain film radiograph further study would be required to demonstrate whether MRI would meaningfully improve patient outcomes prompting this randomized trial.,/wiki/Radiograph_vs._MRI_for_low_back_pain,,
Among patients with heart failure (NYHA class II or III) widened QRS and left ventricular ejection fraction ≤30% does the addition of CRT to an ICD reduce the mortality and morbidity as compared to ICD alone?,The benefit of cardiac resynchronization therapy (CRT) for patients with heart failure has been observed in many trials including the CARE-HF MIRACLE MADIT-CRT and REVERSE trials.[1][2][3][4] The CARE-HF showed that in patients with NYHA Class III or IV heart failure and cardiac dyssynchrony CRT significantly reduced mortality and hospitalization for a major CV event as compared to medical treatment only. In the MADIT-CRT trial CRT combined with ICD (CRT-ICD) reduced the rate of all-cause mortality or non-fatal heart failure in patients with NYHA class II heart failure LVEF ≤30% and QRS duration ≥130 msec.,/wiki/RAFT,,
In patients with HFrEF and NYHA class III-IV symptoms does spironolactone reduce mortality?,'RALES was the first of a series of trials to prospectively study aldosterone antagonists'' mortality benefits in HFrEF. Patients with NYHA class III-IV ischemic or nonischemic HF and EF <35% were randomized to spironolactone or placebo with a majority of patients receiving a background of loop diuretics ACE inhibitors and digoxin. RALES demonstrated a 30% reduction in all-cause mortality with spironolactone without a significant increase in the risk of serious hyperkalemia or renal failure as had been hypothesized.',/wiki/RALES,,
For prehospitalized patients in status epilepticus how effective is intramuscular midazolam compared with intravenous lorazepam for seizure termination?,The current definition of status epilepticus is more than 5 minutes of continuous seizure activity or recurrent seizure activity within this period. This definition is based on the knowledge that seizures extending past 5 minutes are much less likely to spontaneously terminate and animal studies suggested that permanent neuronal injury and resistance to treatment may set in between 5-30 minutes.[1][2][3] Rapid termination of seizure activity is therefore paramount and with multiple antiepileptic agents available randomized studies were needed to determine the most efficacious approach. The Veterans Affairs Status Epilepticus Cooperative Study Group showed better seizure control with lorazepam compared to phenytoin as an initial agent in the context of overt generalized convulsive status epilepticus. The subsequent PHTSE trial[4] comparing diazepam lorazepam and placebo failed to find a significant difference between the two benzodiazepines although there was a trend toward better termination with lorazepam. When intramuscular (IM) formulations of midazolam became readily available these gained significant popularity with paramedics due to their convenience and ease of use.  Also unlike lorazepam midazolam has favorable stability and shelf-life parameters when not refrigerated. A randomized study comparing midazolam and lorazepam was needed to demonstrate comparative efficacy between the two approaches.,/wiki/RAMPART,,
In patients with severe ANCA-associated vasculitis how does rituximab compare to cyclophosphamide for induction of remission when combined with glucocorticoids?,The ANCA-associated vasculitides (eg granulomatosis with polyangiitis or GPA and microscopic polyangiitis or MPA) affect small- and medium-caliber vessels and are associated with pulmonary and renal injury. The efficacy of cyclophosphamide in combination with glucocorticoids was first demonstrated by Fauci and colleagues in the late 1970s and early 1980s[1][2] and has been the mainstay of therapy since. The role of the newer anti-CD20 monoclonal antibody rituximab was unclear.,/wiki/RAVE,,
In patients with mechanical heart valves what dose of dabigatran best achieves therapeutic trough levels and how do these doses compare to warfarin in terms of efficacy and safety?,Dabigatran is an oral direct thrombin inhibitor with several benefits compared to warfarin and growing evidence supports its use in various thrombotic conditions. For example among patients with atrial fibrillation RE-LY (2009) demonstrated the superior efficacy of dabigatran for stroke prevention without increasing rates of bleeding compared to warfarin. For patients with acute VTE RE-COVER (2009) demonstrated similar efficacy and safety with dabigatran compared to warfarin. However among patients with mechanical heart valves no large randomized trial had compared dabigatran to the standard of care warfarin.,/wiki/RE-ALIGN,,
Among patients with acute VTE how does dabigatran compare to warfarin with respect to VTE recurrence and bleeding risk?,The vitamin K antagonist warfarin has long been the standard of care for outpatient therapy of VTE. However its use requires frequent lab draws for monitoring and dose adjustment and as a result a therapeutic INR is achieved only about 60% of the time. Alternative therapies to warfarin include dabigatran an oral direct thrombin inhibitor and rivaroxaban an oral factor Xa inhibitor both of which theoretically require no monitoring. The RE-COVER trial is part of an industry-supported series of trials investigating the role of dabigatran as an alternative to warfarin therapy. It was published in 2009 the same year as the RE-LY trial which demonstrated the noninferiority of dabigatran to warfarin in non-valvular atrial fibrillation.,/wiki/RE-COVER,,
