clinical_question,bottom_line,link_name,,
In patients with stable CAD how does optimal medical therapy plus PCI compare to optimal medical therapy alone in improving survival?,The Clinical Outcomes Utilizing Revascularization and Aggressive Drug Evaluation (COURAGE) trial randomly assigned ~2300 patients with stable CAD to either optimal medical therapy (OMT) alone or OMT plus PCI.  All patients received anti-ischemic therapy with ß-blockers calcium channel blockers and nitrates; antiplatelet therapy with aspirin and/or clopidogrel; and lipid-lowering statin therapy.  The majority of patients in the PCI arm received bare metal stents because drug-eluting stents were not yet approved for use until the final 6 months of the study period.  After a median follow-up of 4.6 years COURAGE demonstrated no significant differences between the two treatment strategies for the primary outcome of death from any cause and non-fatal MI.  There was also no significant difference in the rates of ACS hospitalizations between groups. Followup of the cohorts demonstrated that significantly more patients in the PCI arm were free of angina and had higher overall quality of life by 6 months but this benefit disappeared by 36 months likely reflecting the progression of underlying CAD. Fifteen-year follow-up data published in 2015 found no difference in mortality between the groups.[1],/wiki/COURAGE,,
Among older women residing in nursing homes does administration of cranberry capsules vs. placebo decrease bacteriuria plus pyuria?,Women aged ≥65 are at high risk for bacteriuria plus pyuria. The risk for these women is increased while living in a nursing home. Cranberry products have been used to decrease risk of urinary tract infections (UTIs) but there is little clinical evidence to support this strategy. While UTI is a clinical diagnosis with variability based upon diagnostic approach bacteriuria and pyuria are objective findings thought to be on the causal pathway of UTI. Should cranberry capsules reduce incident pyuria and bacteriuria among high risk women this would potentially support its use in prevention of UTI. ,/wiki/Cranberry_for_prevention_of_pyuria_and_bacteriuria,,
Does tranexamic acid when given within 8 hours to patients with or at risk of significant bleeding reduce death within 4 weeks of injury?,Hemorrhage is a leading cause of death among patients with major trauma. Trauma leads to hemorrhage both from primary injury to organs and blood vessels but also to transient hyperfibrinolysis that is incompletely understood. Tranexamic acid a synthetic derivative of the amino acid lysine appears to interfere with this hyperfibrinolysis prompting investigators to study whether the agent may reduce the morbidity and mortality of traumatic hemorrhage. It has previously been used in controlling bleeding complications in those with hemophilia those undergoing cardiopulmonary bypass and those with menorrhagia. ,/wiki/CRASH-2,,
In patients with T2DM and diabetic nephropathy characterized by albuminuria (ACR >300-5000 mg/g) and reduced GFR (30-90 mL/min/1.73m2 BSA) does canagliflozin 100mg/d reduce the risk of end-stage kidney disease doubling of serum creatinine from baseline and death from renal or cardiovascular disease compared to placebo?,Between 22 to 25 patients would need to be treated for approximately 2.5 years in order to prevent one occurrence of the primary composite outcome.,/wiki/CREDENCE,,
In patients with carotid artery stenosis how does carotid artery stenting compare with carotid endarterectomy in terms of stroke MI and death?,The Carotid Revascularization Endarterectomy vs. Stenting Trial (CREST) compared stenting to endarterectomy in the management of symptomatic and asymptomatic carotid artery stenosis. Prior studies demonstrated stenting as a valid alternative to CEA but yielded conflicting results and a large-scale comparison study had not yet been done. CREST was the largest such comparative study powered to more definitively answer the question of whether stenting or CEA should be the preferred revascularization strategy for patients with carotid stenosis.,/wiki/CREST,,
Among ICU patients with hypovolemic shock does fluid resuscitation with colloids reduce mortality at 28 days when compared to crystalloids? ,'Hypovolemic shock results in tissue hypoperfusion that may be life-threatening. Fluid resuscitation is the mainstay of therapy with crystalloids and colloids among the most commonly used fluid replacement types. Colloids like albumin dextrans and hydroxylethyl starches may selectively fill the intravascular space compared to crystalloids like normal saline and lactated Ringer''s solution which are more widely distributed in both intra- and extravascular fluid compartments. Evidence of a clinical benefit of colloids over crystalloids was lacking however. The 2004 SAFE trial found no benefit for albumin over normal saline for volume resuscitation in a diverse group of ICU patients. Whether colloids would benefit a more specific group of ICU patients with hypovolemic shock was unknown.',/wiki/CRISTAL,,
Among patients with T1DM nephropathy does addition of captopril reduce the creatinine doubling rate when compared to placebo?,Untreated diabetic nephropathy progresses to ESRD in most patients about 10 years after development of proteinuria. Furthermore those with proteinuria have nine times the risk of all-cause mortality than the general population.[1] Early aggressive treatment of concurrent hypertension in this condition was shown to decrease rate of decline of kidney function by Parving et al. in 1983.[2] No large study had been performed with ACE-inhibitors in this disease.,/wiki/CSG_Captopril_Trial,,
In patients with acute myocardial infarction (MI) complicated by cardiogenic shock found to have multivessel CAD on angiography is multivessel percutaneous coronary intervention (PCI) superior to culprit-only PCI?,"There has been substantial investigation into whether patients presenting with acute MI found to have multivessel obstructive coronary artery disease on angiography should undergo PCI of the culprit lesion only or complete revascularization. The previous DANAMI-3-PRIMULTI PRAMI and CvLPRIT trials have suggested that there may be benefit to complete revascularization with a meta-analysis of these trials demonstrating lower rates of composite major adverse cardiac events with complete revascularization. On the strength of these data the 2015 ACC/AHA/SCAI guidelines on primary PCI for ST elevation MI now include PCI of non-culprit lesions in ""selected patients with STEMI and multivessel disease who are hemodynamically stable either at the time of primary PCI or as a planned staged procedure"" as a class IIb recommendation. Whether these findings extend to patients with severe enough MI to cause hemodynamic instability and cardiogenic shock is unclear and is of particular interest since patients with cardiogenic shock complicating MI are far more likely to have multivessel rather than single-vessel CAD.[1] In these cases it remains unknown whether the benefit of improved perfusion and myocardial function afforded by more complete revascularization is offset by the risks inherent to a longer procedure time increased contrast load and possible induction of further ischemia from complex intervention.",/wiki/CULPRIT-SHOCK,,
In adults admitted with community-acquired pneumonia what risk factors are associated with mortality and determine whether patients should be treated as an outpatient or inpatient?,Assessing the risk of CAP and determining whether patients should be treated as out- or inpatients was elusive until several studies demonstrated a method of classifying patients into severe disease. Yet prior to CURB-65 no study had studied the classification of patients into low-risk cohorts; ie those with mild disease that were suitable for outpatient management. Using a derivation cohort and validating it against a smaller cohort CURB-65 identified a 6-point system based on the presence of confusion urea >7 mmol/L (>20 mg/dl) respiratory rate ≥30/min low blood pressure (systolic <90 mmHg or diastolic ≤60 mmHg) and age ≥65 years. Scores of 0 to 1 were associated with low (<2%) 30-day mortality a score of 2 was associated with intermediate (9.2%) mortality and scores of ≥3 were associated with high (22%) mortality.,/wiki/CURB-65,,
In patients with UA/NSTEMI does the addition of clopidogrel reduce CV mortality MI or stroke?,Early trials such as the VA Cooperative Study (1983) and ISIS-2 (1988) demonstrated that aspirin which inhibits platelets through irreversible cyclooxygenase blockade decreases mortality in UA/NSTEMI. Clopidogrel a newer antiplatelet agent that irreversibly binds to the P2Y12 ADP receptors has been suggested to have better outcomes. CURE was designed to evaluate if clopidogrel would further improve outcomes from ACS when added to ASA.,/wiki/CURE,,
Among patients undergoing percutaneous coronary intervention (PCI) for ST-elevation myocardial infarction (STEMI) and found to have multivessel disease on angiography is culprit lesion-only revascularization superior to complete revascularization with regard to a primary composite outcome of death nonfatal MI heart failure or repeat revascularization?,PCI is standard of care for STEMI and has an established mortality benefit in this disease. However up to 30% of patients presenting with STEMI are found to have multivessel CAD with significant stenosis seen in one or more non-infarct-related arteries (N-IRA). It is unclear whether these lesions are simply incidental in which the risks of intervening upon them after culprit vessel revascularization may outweigh the benefits or whether these N-IRA lesions contribute to a pro-thrombotic milieu in which intervention may reduce the risk of recurrent events. Older observational and registry studies suggest that multivessel revascularization either at the time of index PCI or within a short interval lead to either similar or worse outcomes. [1][2] However these retrospective analyses are limited by confounding as sicker patients may be more likely to undergo more aggressive intervention at the time of PCI. In addition PCI technology has improved significantly since the time of these analyses and thus the risk profile of more complex intervention may be lower than previously suggested.,/wiki/CvLPRIT,,
Among patients with newly-diagnosed ANCA-associated vasculitis with renal involvement is pulse cyclophosphamide superior to daily oral cyclophosphamide for the induction of remission?,ANCA-associated vasculitis was almost uniformly fatal until the introduction cyclophosphamide and glucocorticoid therapy was first demonstrated by Fauci and colleagues in the 1970s.[1] The optimal dosing of these medications was unclear. While several small studies suggested that pulse cyclophosphamide was likely equivalent to daily oral cyclophosphamide for the induction of remission in patients with ANCA-associated vasculitis no large trial had been performed.,/wiki/CYCLOPS,,
Among patients with tobacco abuse is cytisine therapy noninferior to nicotine replacement therapy for abstinence at 1 month? ,Common therapies for smoking cessation include nicotine replacement therapy (NRT) and the partial nicotinic ACh agonist varenicline (brand name Champix/Chantix). Cytisine is a generic plant-derived alkaloid that has a similar target to varenicline that is an over-the-counter smoking cessation aide used in Eastern Europe.[1] Its low cost makes it an attractive option for smoking cessation. No large RCT had been performed to compare its efficacy to NRT. ,/wiki/Cytisine_for_Smoking_Cessation,,
In adult patients with JAK2-positive polycythemia vera being treated with phlebotomy and/or hydroxyurea does intensive hematocrit lowering (target <45%) versus a less-intensive strategy (target 45-50%) reduce mortality from cardiovascular or major thrombotic events?,Polycythemia vera (PV) is a myeloproliferative disorder (MPN) characterized by overproduction of erythrocytes — and to a lesser extent granulocytes and platelets — and is driven by a mutation in the JAK2 tyrosine kinase in nearly all cases. PV is associated with arterial and venous thrombotic events related to increased blood viscosity. Lowering the hematocrit has long been shown to have beneficial effect but quantifying the benefit and establishing a therapeutic target has largely been based on observational data.[1]  In fact results from prior PV trials show mixed results of the influence of targeting a lower hematocrit on reducing thrombotic events.[2][3],/wiki/CYTO-PV,,
Among medical ICU patients on mechanical ventilation requiring continuous sedation do daily sedation holidays reduce days intubated in the ICU or in the hospital when compared to physician-guided sedation holidays?,'Continuous sedative infusions reduce anxiety decrease oxygen consumption and reduce nursing requirements among mechanically ventilated ICU patients. However there had been concerns that continuous sedation led to extended courses of mechanical intubation given the inability to assess patients'' overall mental capacity (including detection of new neurologic events) and potential for accumulation of sedatives.',/wiki/Daily_ICU_Sedation_Holidays,,
Among patients undergoing percutaneous coronary intervention (PCI) for ST-elevation myocardial infarction (STEMI) found to have multivessel disease on angiography is culprit lesion-only revascularization superior to fractional flow reserve (FFR) guided complete revascularization with regard to a primary composite outcome of death nonfatal MI or ischemia-driven revascularization?,PCI is standard of care for STEMI and treatment of the infarct-related artery (IRA) has an established mortality benefit in this disease. However up to 30% of patients presenting with STEMI are found to have multivessel CAD with significant stenosis seen in one or more non-infarct-related arteries (N-IRA). It is unclear whether these lesions are simply incidental in which the risks of intervening upon them after culprit vessel revascularization may outweigh the benefits or whether these N-IRA lesions contribute to a pro-thrombotic milieu for which intervention may reduce the risk of recurrent events. Older observational and registry studies suggested that multivessel revascularization either at the time of index PCI or within a short interval lead to either similar or worse outcomes. [1][2] However these retrospective analyses are limited by confounding as sicker patients may be more likely to undergo more aggressive intervention at the time of PCI. In addition PCI technology has improved significantly since the time of these analyses and thus the risk profile of more complex intervention may be lower than previously suggested.,/wiki/DANAMI-3_PRIMULTI,,
In patients with non-ischemic cardiomyopathy with LVEF ≤35% with symptomatic heart failure do implantable cardioverter-defibrillators (ICDs) reduce overall mortality versus standard care?,On the strength of large RCTs including SCD-HeFT and MADIT-II demonstrating a clear mortality benefit ICD implantation carries a class I recommendation for patients with symptomatic cardiomyopathy of any cause with LVEF ≤35% for the purposes of aborting sudden cardiac death.[1] The benefit of ICD implantation is generally considered to be similar in patients with non-ischemic vs. ischemic cardiomyopathy even though the majority of patients in SCD-HeFT and all of the patients in MADIT-II had cardiomyopathy with ischemic origin. Furthermore it is not clear that ICD implantation carries the same benefit in the heart failure population in the era of more frequent use of optimal medical therapy for heart failure and cardiac resynchronization therapy (CRT) in patients with severe cardiomyopathy with significant conduction system disease.,/wiki/DANISH,,
In patients with or without type 2 diabetes and chronic kidney disease characterized by eGFR reduction and microalbuminuria does dapagliflozin affect the progression of chronic kidney disease and cardiovascular death?,CKD is a risk factor for death among adults regardless of diabetes status.[1] Few options exist to prevent progression of CKD and reduce the risk of CKD-associated death. For example ACE-inhibitors and ARBs may prevent progression of progression to albuminuria but do not clearly alter changes in serum creatinine.[2] There is an urgent need to identify potential mechanisms to prevent progression of CKD. ,/wiki/DAPA-CKD,,
In individuals with heart failure with reduced ejection fraction (NYHA II-IV LVEF ≤40%) with or without diabetes does the addition of the SGLT-2 inhibitor dapagliflozin reduce rates of cardiovascular death or worsening heart failure?,In 2008 the US Food and Drug Administration began requiring every new drug for diabetes to be tested in a cardiovascular outcomes trial. Because of this the development of three new sodium-glucose cotransporter 2 (SGLT-2) inhibitors for diabetic patients was accompanied by three cardiovascular outcomes trials (CANVAS[1] EMPA-REG[2] and DECLARE-TIMI 58[3]). EMPA-REG and CANVAS showed reductions in composite primary outcomes of CV mortality nonfatal MI or nonfatal stroke as well as reductions in HF hospitalizations among patients with diabetes. Though the mechanisms of cardiovascular benefit remains unclear it is likely to be driven by a reduction in HF death given that rates of MI were similar between treatment arms. In the more recent DECLARE-TIMI 58 study dapagliflozin did not show a statistically significant reduction in the primary outcome of major adverse CV events but did show a reduction in the composite of CV death or hospitalization for HF. Prior studies were not powered to examine this class of medications in the setting of HF with reduced ejection fraction (HFrEF).,/wiki/DAPA-HF,,
Among patients who have completed one year of dual antiplatelet therapy (DAPT) after drug-eluting stent PCI does continued DAPT reduce stent thrombosis and death MI or stroke without increasing bleeding?,Drug-eluting stents are intended to have lower rates of late restenosis than bare-metal stents through inhibition of neointimal proliferation.[1] However drug-eluting stents are at higher risk for in-stent thrombosis because of delayed endothelialization incomplete healing hypersensitivity and underlying atherosclerotic disease.[2][3][4] This risk is greatly reduced with DAPT typically with aspirin and a thienopyridine (eg clopidogrel). The 2011 ACC/AHA/SCAI guidelines recommend 12 months of therapy[5] although the optimal duration is not known.,/wiki/DAPT,,
In patients with chronic HTN does a diet rich in fruits vegetables and low-fat dairy and low in saturated fats reduce blood pressure? ,Several trials have evaluated non-pharmacologic approaches to lowering BP including dietary and behavioral modifications.  For example TOMHS trial (1993)[1] evaluated a program of weight reduction sodium restriction and exercise.  The DASH trial (1997) evaluated a combination diet which is known today as the DASH diet and the DASH-sodium study (2001)[2] evaluated sodium restriction in addition to the DASH diet.  Most recently the PREMIER trial (2003)[3] also assessed the DASH diet with or without dietary/behavioral modification such as  weight loss physical activity and limitations in sodium and alcohol intake.,/wiki/DASH,,
In patients with an indication for an implantable defibrillator does obligate dual-chamber pacing improve mortality or hospitalization for heart failure compared to ventricular backup pacing?,"By the early 2000s on the strength of RCTs such as MADIT-II SCD-HeFT and AVID the indications for implantable defibrillators (ICDs) had expanded to include patients both with a history of significant ventricular arrhythmias as well as patients at high risk for developing them due to severe cardiomyopathy. In most of these studies the effectiveness of ICD therapy in reducing mortality was established using devices with a single lead in the right ventricle. Since these single-chamber ventricular devices cannot sense atrial activity pacing with these devices can result in simultaneous atrial and ventricular contraction leading to bothersome symptoms associated with backflow of blood from the atria (the pacemaker syndrome). As a result these devices were usually set to a ""backup only"" mode whereby pacing would only activate at very low heart rates. Furthermore out of fear of causing pacemaker syndrome by eliciting bradycardia patients with CHF often failed to receive optimal doses of beta-blocker and/or antiarrhythmic therapy. As a result there was a belief that routine placement of dual-chamber ICDs with the capability to provide synchronous atrial and ventricular pacing at a normal heart rate may allow these patients to tolerate more optimal medical therapy for HF with no risk of pacemaker syndrome.",/wiki/DAVID,,
Among patients with acute stroke between 6-24 hours of symptom onset does thrombectomy improve 90-day outcomes compared to standard care alone?,Several studies including MR CLEAN demonstrated the superiority of endovascular thrombectomy versus standard care alone among patients with acute stroke when performed within 6 hours of symptom onset. The benefits of the intervention declined as the time since onset increased.[1] However a subset of acute stroke patients have brain tissue that is ischemic but not yet infarcted; these patients have a clinical deficit that is disproportionately severe when compared to the amount of infarcted tissue on imaging. Among these patients there is currently limited evidence as to whether the ischemic tissue may be salvaged with reperfusion via thrombectomy. Therefore the purpose of this trial was to recruit patients with a mismatch between their clinical deficit and the volume of infarct on imaging studies.,/wiki/DAWN,,
In patients with T1DM how does strict glycemic control with intensive therapy compare with conventional therapy in preventing microvascular complications?,The Diabetes Control and Complications Trial (DCCT) demonstrated that strict glycemic control targeting lower HbA1c goals among patients with T1DM can both delay the onset of retinopathy nephropathy and neuropathy and slow the progression of existing microvascular complications. This came at the expense of a threefold higher risk of hypoglycemia underlying the fact that HbA1c goals should be tailored to the individual.,/wiki/DCCT,,
In patients with nonischemic dilated cardiomyopathy and NYHA class II-IV symptoms what is the effect of an implantable cardioverter-defibrillator (ICD) on the risk of sudden death?,Sudden cardiac death is the leading cause of death among patients with symptomatic HF. Several trials including MADIT-I MADIT-II MUSTT and SCD-HeFT demonstrated a mortality benefit of prophylactic ICD placement in various patient groups including both ischemic and nonischemic cardiomyopathy.,/wiki/DEFINITE,,
In recently hospitalized elderly patients does ramelteon reduce the risk of delirium compared to placebo?,Delirium and other acute confusional states are common among hospitalized patients and older individuals are disproportionately affected. Because treatment is challenging and often ineffective the mainstay of management has been prevention. A 2007 Cochrane review[1] concluded that sparse evidence existed supporting any intervention to prevent delirium citing only early geriatric consultation as an evidence-based intervention in selected patients. There remains a sizable gap in the evidence for strategies that can prevent delirium.,/wiki/DELIRIA-J,,
Among patients with suspected myocardial infarction without hypoxemia did routine use of supplemental oxygen reduce all-cause mortality at 1 year when compared to ambient air?,The role of supplemental oxygen among adults with suspected acute MI without hypoxemia is uncertain and recent practice guidelines have highlighted a lack of evidence in its routine administration in MI.[1][2] Further a 2015 meta-analysis of oxygen use showed no significant difference with end points when comparing those randomized to high-concentration oxygen versus those randomized to titrated oxygen or room air in the setting of AMI [3] The 2017 AVOID trial of oxygen and acute myocardial infarction in normoxia suggested that patients with MI assigned to oxygen may have a larger infarct on a subset of patients who underwent cardiac MRI. However the role of oxygen among undifferentiated patients with findings concerning for MI was unclear. ,/wiki/DETO2X-AMI,,
Among patients with HFrEF does digoxin impact mortality or hospitalization rate compared to placebo?,Digoxin had been a mainstay of therapy for patients with HF and according to some epidemiologic studies was the most commonly prescribed agent for HF until fairly late in the 20th century. There was of course strong data demonstrating the mortality benefit of ACE inhibitors beta-blockers and other agents in HFrEF but little data supported a survival benefit to digoxin. The 1997 DIG trial sought to investigate whether digoxin improved survival or reduced hospitalizations among individuals with chronic compensated HFrEF. Digoxin reduced hospitalizations by 28% but had no statistically significant effect on all-cause mortality. However a subgroup analysis of those with severe HFrEF had a trend towards a survival benefit.,/wiki/DIG,,
