clinical_question,bottom_line,link_name,,
In adult patients with lower respiratory tract infections without evidence of pneumonia how does the administration timing or lack of antibiotics correlate to reconsultation for non-resolving symptoms hospital admission or death?,Antibiotics have not demonstrated clear benefit when administered for acute uncomplicated (e.g. no pneumonia or lung abscess) ambulatory community based lower respiratory tract infections in clinical trials[1] or in a Cochrane review.[2],/wiki/3C,,
In critically ill patients requiring central venous access how do complications vary by central venous catheter (CVC) access site?,Central venous catheters (CVCs) are associated with infrequent but potentially severe complications including catheter-related bloodstream infection (CRBSI) DVT and pneumothorax. A 2001 French randomized study demonstrated that subclavian insertion was associated with fewer infectious and thrombotic complications than femoral insertion but internal jugular (IJ) insertion was not studied.[1] A 2012 meta-analysis of mostly nonrandomized studies suggested that the subclavian approach may be associated with fewer infectious complications than femoral or IJ insertions. However it concluded that a randomized trial was necessary to confirm the rates of these complications by access site.[2],/wiki/3SITES,,
Among patients with prior MI or angina with hyperlipidemia does addition of simvastatin reduce all-cause mortality when compared to placebo?,"Hyperlipidemia was first identified as a risk factor for CAD in a publication from the Framingham Study group (1961).[1] Early trials with cholesterol modifying agents had modest success. LRC-CPPT (1984)[2] demonstrated a significant 1.6% absolute reduction in fatal or non-fatal MI at 7 years with use of the bile acid sequestrant cholestyramine in patients with type II hyperlipoproteinemia. The Helsinki Heart Study (1987)[3] demonstrated a similar reduction in the incidence of CAD with the fibrate gemfibrozil men hyperlipidemia. Neither trial demonstrated a mortality benefit. A new class of cholesterol-lowering medications called ""statins"" lowered cholesterol by reducing endogenous production through inhibition of HMG-CoA reductase. Their role in patients with CAD resultant to their hyperlipidemia was unclear.",/wiki/4S,,
In ICU patients aged ≥65 years with vasodilatory hypotension what is the effect on 90 day mortality by reducing the vasopressor exposure through permissive hypotension of target MAP of 60-65 mmHg?,The single-center Rivers Trial (2001) found a mortality benefit from an Early Goal Directed Therapy (EGDT) strategy including several interventions including MAP >65 mm Hg with vasopressors as needed. There is a dearth of evidence to support this specific MAP target and subsequent multicenter sepsis studies comparing the protocol from the Rivers Trial versus other care patterns were largely negative (e.g. ProCESS 2014; ARISE 2014; ProMISe 2015). These subsequent studies assessed the entire EGDT protocol versus other standards. Whether a higher MAP target alone provided benefit in vasodilatory shock among adults in the ICU was unclear. The use of vasopressor medications to achieve this MAP might introduce unneeded harm to the patients with shock since they involve shunting of the patients blood away from some areas in the body and risk of arrhythmias. ,/wiki/65_Trial,,
Among self-identified black patients with HFrEF does the combination of isosorbide dinitrate and hydralazine improve survival compared to placebo?,Self-identified black individuals may have less activity of the renin-angiotensin-aldosterone system (RAAS) rendering ACE inhibitors ARBs and beta-blockers relatively less effective.[1] A subgroup analysis of self-described black patients in V-HeFT (1986) was the first to suggest a survival benefit to isosorbide dinitrate (ISDN)/hydralazine a combination that targets non-RAAS pathways leading to increased nitric oxide and decreased reactive oxygen species.,/wiki/A-HeFT,,
Among African Americans with hypertensive kidney disease does intensive blood pressure control slow progression of CKD more than usual BP control?,African American adults experience a disproportionate burden of hypertension and hypertension-related chronic kidney disease when compared to white Americans.[1][2] One small analysis from the MDRD trial suggested a potential benefit in prevention progression of kidney disease with intensive BP control.[3] However the appropriate management of these interrelated conditions was unknown in the 1990s.,/wiki/AASK,,
In patients with symptomatic (NYHA II-III) heart failure with reduced ejection fraction (LVEF ≤40%) and persistent atrial fibrillation (AF) chosen for a rhythm control strategy is AF ablation superior to amiodarone with regard to AF-free survival?,Multiple RCTs including the landmark AFFIRM trial (2002) have demonstrated similar outcomes with a rate control strategy (i.e. use of AV nodal blockade to attain a safe heart rate with no intent to restore sinus rhythm) versus a rhythm control strategy (i.e. use of antiarrhythmic drugs [AAD] or procedures to restore and maintain sinus rhythm) in patients with AF. Nevertheless these initial trials included primarily older patients without structural heart disease and in particular patients with significant LV dysfunction were underrepresented. The later AF-CHF trial (2008) however specifically studied patients with concomitant AF and systolic HF and again found no significant difference in outcomes with rate versus rhythm control.,/wiki/AATAC,,
Among patients with HTN at high risk for CV complications how does benazepril/amlodipine compare to benazepril/HCTZ in reducing cardiovascular events?,No single antihypertensive has proven significantly better than others for the general population. The large comparative ALLHAT trial (2002) did not clearly demonstrate difference between a single-agent diuretic ACE inhibitor or CCB although it suggested that chlorthalidone (not widely used in the US) may be preferable. Two or more medications are required to control most hypertensives[1] which raises the question of whether trials should study head-to-head comparisons of single agents. The ACCOMPLISH trial sought to compare combination ACE inhibitors plus diuretic to combination ACE inhibitor plus CCB in terms of rates of CV events and death.,/wiki/ACCOMPLISH,,
In patients with T2DM does intensive glycemic control targeting a HbA1c <6% versus standard glycemic control targeting a HbA1c 7-7.9% reduce the risk of CV events?,Cardiovascular disease is a major cause of morbidity and mortality in patients with T2DM. The 2005 EDIC (an extension of the 1993 DCCT trial) demonstrated that improved glycemic control reduces the rate of long-term CVD in patients with T1DM. However this macrovascular outcome had not been replicated in similar trials in patients with T2DM (including the 1998 UKPDS 33).  Whether patients with T2DM have reduced incidence of CVD with near-euglycemic control (i.e. pushing the HbA1C goal <7%) was unclear.,/wiki/ACCORD,,
In patients with T2DM at high risk for CV events does intensive BP control (SBP <120 mmHg) reduce rates of nonfatal MI nonfatal stroke or CV mortality when compared to standard BP control (SBP <140 mmHg)?,Patients with T2DM are at elevated risk for CVD. HTN is an independent risk factor for CVD. The JNC 7 recommended targeting SBP to 130 mmHg despite a lack of large RCTs supporting this recommendation. ,/wiki/ACCORD_BP,,
Among adults with T2DM on statin monotherapy does addition of a fibrate reduce risk of CVD?,Adults with T2DM experience excess morbidity and mortality from CVD.[1] Atherogenic cholesterol subtypes and inflammation are thought to be on the causal pathway of CVD.[2] Statins promote a more optimal lipid profile through suppression of HMG-CoA reductase and reduce inflammation through their effects on multiple pathways.[3] Multiple studies have found statins to be effective in primary and secondary prevention of CVD in various populations. Among adults with T2DM CARDS (2004) found atorvastatin to reduce the hazard of CVD endpoints by 37%. However CVD remained elevated at 1.54/100 person-years during the follow-up period. Whether further optimization of lipids with non-statin medications would benefit diabetics was unknown. ,/wiki/ACCORD_Lipid,,
Among T1-2 breast cancer patients with a positive sentinel lymph node biopsy undergoing lumpectomy and whole-breast radiation does axillary lymph node dissection improve survival or local control compared to nodal observation?,Axillary lymph node dissection (ALND) has historically been a means of maintaining regional control of breast cancer especially in patients with initial presentation of metastatic nodal disease. Sentinel lymph node biopsy is a commonly used method of detecting micrometastatic axillary disease at initial presentation. Due to the significant morbidity of ALND including paresthesias lymphedema seroma and infection judicious use of the procedure is important. The randomized NSABP B-32 study demonstrated that patients with a negative sentinel lymph node biopsy (SLNB) could be spared ALND.[1] Whether ALND might be avoided in patients with clinically negative axillary nodes and fewer than 3 positive sentinel lymph nodes was unknown. ,/wiki/ACOSOG_Z0011,,
Among patients undergoing coronary and peripheral vascular angiography does acetylcysteine reduce the risk of contrast-induced acute kidney injury?,Acetylcysteine reduces oxidative stress[1] and may improve renal perfusion.[2] Numerous small or otherwise low-quality trials have been published investigating whether acetylcysteine reduced the incidence of contrast-induced acute kidney injury (CI-AKI) in patients undergoing angiography.  ,/wiki/ACT,,
Among patients with atrial fibrillation who are not suitable candidates for vitamin K antagonists does the addition of clopidogrel to aspirin reduce the risk of vascular events compared to aspirin alone?,AF was first identified as a risk factor for stroke in a 1978 Framingham study publication.[1][2] The 1991 SPAF study[3] demonstrated the superiority of warfarin over aspirin in stroke prevention in AF. Despite the benefits of anticoagulation many patients with AF do not receive such therapy because of a known or perceived risk of bleeding or another factor that renders VKAs unsuitable. For years such patients had been prescribed aspirin or combination aspirin/clopidogrel although the comparative efficacy of these strategies had not yet been rigorously studied until ACTIVE A.,/wiki/ACTIVE_A,,
Among patients with nonvalvular AF how does combination aspirin/clopidogrel compare to warfarin in reducing the incidence of stroke systemic embolism MI or CV death?,The 2006 Atrial fibrillation Clopidogrel Trial with Irbesartan for prevention of Vascular Events (ACTIVE W) randomized 6706 patients with nonvalvular AF and one or more additional risk factors for stroke to open treatment with either aspirin/clopidogrel or warfarin. At a mean follow-up of 1.3 years combination aspirin/clopidogrel was inferior to anticoagulation at reducing the composite incidence of stroke non-CNS systemic embolus MI or CV death (annual risk 5.6% vs. 3.9%) and was associated with increased bleeding (15.4% vs. 13.2%). A post hoc subgroup analysis suggested that anticoagulation conferred no benefit over antiplatelet therapy among patients receiving low-quality anticoagulation (ie those time in therapeutic range <58%).,/wiki/ACTIVE_W,,
Among patients hospitalized for Covid-19 with lower respiratory tract involvement does remdesivir reduce the time to recovery?,Originally developed as a treatment for the Ebola virus remdesivir is a prodrug adenosine analogue that inhibits RNA-dependent RNA polymerases of several RNA viruses. Remdesivir was identified as a potentially promising therapeutic agent for the treatment of Covid-19 after preclinical investigations discovered in vitro inhibitory activity against SARS-CoV-2 as well as related coronaviruses SARS-CoV and MERS-CoV.,/wiki/ACTT-1,,
Does administration of cisatracurium improve survival when compared to placebo in ICU patients undergoing mechanical ventilation for early severe ARDS?,The high mortality of ARDS -- up to 46% at 60 days[1] -- has been improved upon by only a few interventions most notably the ARDSNet (2000) low tidal volume protocol. Therapeutic paralysis has been used in synergy with sedation to improve mechanical ventilation. However its role as a treatment modality for ARDS was unclear.,/wiki/ACURASYS,,
In patients older than 50 presenting to the ED with clinically-suspected PE is using an age-adjusted D-dimer cutoff versus conventional cutoff (>500 µg/L) associated with an increased diagnostic yield?,Pulmonary embolism (PE) is a potentially life-threatening disorder that is frequently considered in the emergency medicine differential diagnoses. Given its significant morbidity and mortality it must be rapidly ruled out. The presentation of PE is often non-specific and diagnostic testing and treatment can be associated with significant adverse events. D-dimer testing with a threshold of 500 μg/L has been shown to be a highly sensitive test with a correspondingly high negative predictive value among patients with low pretest probability for PE. However several studies have shown that D-dimer levels increase with age thereby limiting the yield and cost-effectiveness of D-dimer testing among older patients.[1][2] Retrospective and meta-analysis studies suggested that a simple age adjustment (age × 10 in patients >50 years) may better define an optimal D-dimer cutoff value among older patients.[3][4] ADJUST-PE sought to prospectively validate this method.,/wiki/ADJUST-PE,,
In patients with septic shock requiring ventilatory and vasopressor support does a continuous week-long infusion of hydrocortisone 200 mg/day improve mortality at 90 days when compared to placebo?,Multiple RCTs have investigated the potential role for steroid therapy in patients with septic shock. The Annane Trial in 2002 with 299 patients demonstrated a short-term mortality benefit with IV hydrocortisone and fludrocortisone among patients with evidence of adrenal insufficiency on ACTH stimulation testing. CORTICUS with 499 patients in 2008 investigated hydrocortisone in patients with and without adrenal insufficiency and found a faster reversal of shock but no benefit in either subgroup with suggestion of increased infection rates in patients receiving hydrocortisone. HYPRESS in 2016 with 380 patients showed no difference in mortality but showed decrease time to reversal of shock.,/wiki/ADRENAL,,
In patients with T2DM what are the vascular effects of intensive glycemic therapy targeting a HbA1c ≤6.5%?,In the 2008 ADVANCE trial sulfonylurea-based intensive glycemic therapy targeting a HbA1c ≤6.5% was associated with a 10% reduction in combined micro- and macrovascular events compared with standard therapy. This was largely driven by a 23% reduction in the risk of microvascular events principally nephropathy. There was no reduction in the risk of macrovascular events.,/wiki/ADVANCE,,
Among patients with AF and HFrEF does rhythm-control reduce cardiovascular mortality as compared to rate control?,The AFFIRM trial showed that among patients with non-valvular AF there was no significant mortality difference between rate-control and rhythm-control strategies. There are specific issues related to patients with AF and heart failure (HF). Heart failure patients have a higher risk of developing AF. They are also at a higher risk for adverse effect from certain anti-arrhythmic drugs. Hence the investigators aimed to determine if rhythm-control would reduce cardiovascular mortality as compared to rate control.,/wiki/AF-CHF,,
Among patients with atrial fibrillation and a high risk of stroke or death what are the effects of rate control versus rhythm control on mortality?,The 2002 Atrial Fibrillation Follow-up Investigation of Rhythm Management (AFFIRM) trial was the first and largest study to compare rate-control and rhythm-control strategies for the treatment of AF. Among 4060 patients with non-valvular AF and a high risk of stroke or death AFFIRM demonstrated no survival advantage between rate-control (using ß-blocker calcium channel blocker and/or digoxin) and rhythm-control strategies.  All patients were anticoagulated on warfarin initially but patients in the rhythm control arm who maintained normal sinus rhythm for at least 4 consecutive weeks could stop.  In fact there was a nonsignificant trend toward a decrease in mortality associated with the rate-control strategy particularly those aged ≥65 and those without a history of HF.  However rates of ischemic stroke were similar between both groups at approximately 1% per year.,/wiki/AFFIRM,,
Among eligible women does initiation of breast cancer screening with mammograms at age 40-41 reduce breast cancer mortality when compared to initiation at age 50?,Screening mammography to reduce breast cancer mortality in women was demonstrated as effective in multiple trials including the 1971 HIP[1] and 1985 Swedish Two Counties[2] studies. Evidence supporting screening before the age of 50 years was lacking.[3] Publications addressing the utility of screening in women age 40-49 were were largely secondary analyses of larger population screening trials.[4] As mammography is associated with multiple potential harms including psychological distress from false-positives pain overdiagnosis overtreatment[5] and radiation exposure[6] whether to screen women age 40-49 years old has been controversial.,/wiki/Age_Trial,,
In patients with stable or unstable coronary artery disease (CAD) undergoing percutaneous coronary intervention (PCI) are bioresorbable scaffolds superior to standard drug-eluting stents (DES) with regard to target-vessel failure?,Although current second-generation DES are the best established and most efficacious means of achieving and maintaining coronary artery patency in the setting of obstructive CAD they are still associated with an ongoing risk of stent thrombosis (approximately 0.1-0.2% per year) and in-stent restenosis (2-3% per year). Theoretically recently developed biosorbable metallic scaffolds leave no permanent implant and thus may allow for better restoration of natural vessel function after revascularization. The ABSORB-III trial demonstrated noninferiority with the bioresorbable scaffold versus everolimus-eluting DES with regard to target-vessel patency at 1 year. However multiple observational studies as well as longer-term follow up of the related ABSORB II trial suggest that scaffolds may be associated with higher medium-term device failure rates than DES. [1][2] Nevertheless scaffolds have been approved for use by the FDA and the EU and have already begun to achieve significant clinical use. A longer-term RCT investigating the comparative efficacy and safety of scaffolds vs. DES was needed.,/wiki/AIDA,,
In patients with colchicine-resistant steroid-dependent recurrent pericarditis does the IL-1B antagonist anakinra reduce recurrent pericarditis compared to placebo?,Recurrent pericarditis is a major clinical problem affecting up to 30% of patients after a first episode of acute pericarditis and up to 50% of patients after a first recurrence when colchicine is not used[1]. As shown in the ICAP trial upfront combined therapy with both colchicine and anti-inflammatory agents is effective in reducing risk of recurrence after acute pericarditis but even with this therapy recurrence still occurs around 20% of the time. Although oral steroids are often effective in treating recurrent pericarditis patients who require steroids for this indication often have difficulty with recurrence when steroids are weaned off and are therefore exposed to the myriad side effects of long-term steroid therapy. Whether the addition of more novel anti-inflammatory agents may allow for steroid-sparing therapy in refractory recurrent pericarditis is unclear although there have been suggestions from retrospective studies and case series that anakinra may be effective in this setting.,/wiki/AIRTRIP,,
Among ICU patients with AKI does early renal replacement therapy (RRT) reduce mortality as compared to delayed RRT?,Renal replacement therapy (RRT) is a life-saving intervention among critically-ill patients with severe AKI. However some of these patients with severe AKI spontaneously recover renal function and may not need urgent RRT. While RRT is generally well-tolerated it is associated with procedure-related complications (eg line infections). Conversely early removal of uremic toxins may provide benefit among the critically-ill.  As such the timing of initiation of RRT was a matter of debate among critically-ill patients with severe AKI. ,/wiki/AKIKI,,
Among patients with severe sepsis or septic shock does administration of albumin 20% solution to maintain serum albumin level ≥3 g/dL (≥30 g/L) reduce all-cause mortality at 28 days when compared to no albumin?,Selection of volume for resuscitation in ICU patients was addressed in the 2004 SAFE trial which compared albumin and crystalloids. In the severe sepsis subgroup in SAFE albumin demonstrated a non-significant trend towards lower all-cause mortality at 28 days with albumin (P=0.09). A 2006 pilot trial by Dubois et al.[1] suggested that daily IV albumin administration for serum albumin <3.1 g/dL (<31 g/L) may improve SOFA score (for organ function) for critically ill hypoalbuminemic patients. A large randomized controlled trial to evaluate for benefit of albumin in patients with severe sepsis or septic shock was lacking.,/wiki/ALBIOS,,
Among patients with cirrhosis and spontaneous bacterial peritonitis treated with antibiotics does intravenous albumin reduce incident renal impairment and mortality when compared to antibiotics alone?,'Spontaneous bacterial peritonitis (SBP) is a common infection associated with cirrhosis that carries significant morbidity and mortality. While antibiotics mitigate some harm SBP survivors experience a high incidence of renal dysfunction.[1] The underlying mechanism of SBP''s harm are thought to be related to a decrease in effective arterial blood volume from the infection. As individuals with cirrhosis have a low baseline oncotic pressure renal perfusion is reduced leading to renal insufficiency. Albumin increases oncotic pressure over the short term and its administration may improve renal perfusion renal outcomes and mortality among those with SBP.  ',/wiki/Albumin_for_SBP,,
In patients with hypertension what is the efficacy of a calcium channel blocker ACE inhibitor or thiazide diuretic in lowering the incidence of CV events?,Hypertension is a major risk factor for numerous conditions including CAD. The optimal choice of antihypertensive for prevention of CAD endpoints was unclear. Published in 2002 the Antihypertensive and Lipid-Lowering Treatment to Prevent Heart Attack Trial (ALLHAT) sought to determine which of four agents antihypertensive performed best in terms of fatal CAD and nonfatal MI. The study enrolled 33357 participants age ≥55 years with hypertension and at least one CAD risk factor. The study drug was instituted and additional open-label agents were added to achieve BP goals. The pragmatic ALLHAT found that compared to amlodipine chlorthalidone performed similarly in reducing overall incidence of CAD but decreased the incidence of HF. Compared to lisinopril chlorthalidone reduced overall CAD by 10% stroke by 15% HF by 19% and angina by 11%. The doxazosin arm was terminated prematurely because of a significantly increased risk of HF compared to chlorthalidone noted during an interim analysis. Following ALLHAT thiazides became widely used as first-line agents for essential hypertension.,/wiki/ALLHAT,,
In the ALLHAT-LLT study did patients aged ≥65 years with moderate hyperlipidemia and hypertension but without atherosclerotic cardiovascular disease (ASCVD) benefit from the addition of statin therapy in terms of all-cause mortality when compared to usual care alone?,Previous studies have quantified that 28% of patients 75-79 and 22% of patients 80 and older take statins for primary prevention[1] and statin use for primary prevention in patients older than 79 has increased from 8.8% in 1999-2000 to 34.1% in 2011-2012.[2] A 2015 Markov model reported that while statins may be cost effective for primary prevention in patients 75 years and older any benefit could be easily offset by an increase in adverse events.[3],/wiki/ALLHAT-LLT_Elderly,,
Among patients with active lupus nephritis is mycophenolate superior to cyclophosphamide for the induction of a renal response?,Clinically significant renal involvement occurs in approximately half of patients with lupus and renal histology in patients with lupus nephritis predicts responsiveness to therapy. Focal proliferative (class III) and diffuse proliferative (class  IV) lupus nephritis are mediated by immune and inflammatory mechanisms responsive to immunosuppression and antiinflammatory therapy and preferred therapy has generally been with a combination of prednisone plus cyclophosphamide based upon a landmark study from the NIH.[1] Due to the toxicities of cyclophosphamide including an increased risk of bladder toxicity and ovarian failure alternative strategies have been investigated such as reduced-dose and short-course cyclophosphamide as well as alternative immunosuppressants such as mycophenolate mofetil (MMF). Several studies have compared cyclophosphamide and MMF generally finding that MMF is equivalent to cyclophosphamide in terms of efficacy with a lower risk of ovarian failure.[2][3],/wiki/ALMS,,
