clinical_question,bottom_line,link_name,,
Among patients with untreated advanced non-small-cell lung cancer (NSCLC) with PD-L1 expression and without EGFR mutations or ALK rearrangements does pembrolizumab improve progression-free survival compared to platinum-based chemotherapy?,Recent years have seen the approval of immune checkpoint inhibitors for the treatment of multiple malignancies. These agents improve the ability of the immune system to recognize and kill tumor cells. The first approved checkpoint inhibitor was ipilimumab a monoclonal antibody targeting cytotoxic T-lymphocyte antigen 4 (CTLA-4) in the treatment of melanoma.[1] Further studies demonstrated that targeting the programmed death 1 (PD-1) and programmed death ligand 1 (PD-L1) axis using fully humanized IgG4 monoclonal antibodies against PD-1 (pembrolizumab nivolumab) or PD-L1 (atezolizumab) was more effective than chemotherapy in first-line metastatic melanoma[2] second-line advanced renal cell carcinoma[3] second-line advanced nonsquamous NSCLC[4] recurrent or metastatic squamous cell carcinoma of the head and neck[5] and had significant responses in second-line advanced urothelial carcinoma[6] and refractory classical Hodgkin lymphoma.[7],/wiki/KEYNOTE-024,,
Among patients with T2DM at increased risk for CV events does daily liraglutide reduce CV mortality nonfatal MI or nonfatal strokes when compared to placebo?,The global prevalence of diabetes is expected to rise from an estimated 2.8% (171 million) to 4.4% (366 million) in 2030.[1] Diabetes is a major independent risk factor for cardiovascular disease. Several large scale glucose-lowering medication trials including PROactive (2005) EXAMINE (2013)[2] SAVOR-TIMI 53 (2013)[3] TECOS (2015) and ELIXA (2015)[4] and the Look AHEAD lifestyle intervention trial (2013) have disappointingly failed to show a significant reduction in CV events. UKPDS 34 (1998) and SPREAD-DIMCAD (2013)[5] showed reduction in CVD events with metformin. Similarly the 2015 EMPA-REG OUTCOME found a CVD benefit with empaglifozin an SGLT-2 inhibitor.,/wiki/LEADER,,
Among patients with high-risk smoldering myeloma does early treatment with lenalidomide plus dexamethasone improve progression-free survival compared to observation?,"Multiple myeloma is a plasma-cell malignancy that leads to characteristic features of hypercalcemia renal dysfunction anemia and lytic bone disease. Observational studies revealed that nearly all patients diagnosed with myeloma have a prephase of disease starting with monoclonal gammopathy of undetermined significance (MGUS) and progressing to asymptomatic (""smoldering"") multiple myeloma over a period of years. Efforts to delay symptomatic progression and death have focused on early initiation of therapy for patients with these precursor conditions. A logical group of patients to focus on has been patients with patients with smoldering myeloma who are estimated to have a high risk of progression to symptomatic myeloma based on biomarkers.",/wiki/LenDex_in_High-Risk_Smoldering_Myeloma,,
Among patients with lumbar spinal stenosis and associated pain does an epidural injection of a glucocorticoid plus lidocaine reduce disability and leg pain at six weeks when compared to an injection of lidocaine alone?,"Epidural administration of glucocorticoids is widely used for symptomatic relief in patients with spinal stenosis though the therapy has not been evaluated in a large randomized trial. A 2013 Cochrane review classified the existing evidence for epidural injections in this disease as ""very low quality"" and identified an urgent need for clinical trials.[1]",/wiki/LESS,,
In surgical ICU patients how does intensive compare to conventional glycemic control in reducing mortality?,The single center Leuven Surgical Trial in 2001 so named because it took place in the Belgian city and involved predominantly surgical patients randomized 1548 surgical ICU patients to intensive glycemic control (goal glucose 80-110 mg/dL) vs. conventional glycemic control (180-200 mg/dL).  This trial demonstrated a significantly lower ICU mortality in the intensive glycemic control arm particularly among patients who were in the ICU for 5 days or longer.  This mortality benefit was not replicated in the same Leuven center in medical ICU patients in the 2006 Leuven Medical Trial.,/wiki/Leuven_Surgical_Trial,,
Among patients with low/intermediate-risk acute promyelocytic leukemia how does combination ATRA plus arsenic trioxide compare to conventional therapy with ATRA plus chemotherapy?,Acute promyelocytic leukemia (APL) accounts for about 10% of acute myeloid leukemia (AML) cases and is associated with severe DIC and early death. Traditionally it had been treated with chemotherapy similar to other cases of AML. Advances in the molecular understanding of APL identified the t(15;17) translocation as the sine qua non of APL. This translocation results in the PML-RARA fusion product leading to the arrest of myeloid differentiation and the clinical phenotype of APL. In the 1980s studies demonstrated that all-trans retinoic acid (ATRA) could reverse this maturation block and clinical investigations demonstrated that single-agent ATRA was associated with hematologic complete responses (CR) in 85% of patients with APL. The finding that arsenic trioxide (ATO) induces apoptosis in APL blasts prompted the development of chemotherapy-free regimens including ATRA-ATO which delivered CR in >90% of patients in initial studies. Additionally it was hypothesized that ATRA-ATO may be associated with less treatment-related toxicity. This landmark study was carried out to compare ATRA-ATO and ATRA-chemotherapy and determine whether patients with APL could be cured without chemotherapy.,/wiki/Lo-Coco_2013,,
In patients with clinically stable coronary disease does taking colchicine 0.5 mg/day as compared to no colchicine reduce the risk of cardiovascular events? ,A retrospective study published in 2012 demonstrated a lower incidence of MI in patients with gout on colchicine[1] although a randomized prospective trial was lacking.,/wiki/LoDoCo,,
In patients with chronic coronary disease does colchicine improve cardiovascular outcomes?,'The anti-inflammatory medication Colchicine was postulated to have cardioprotective effects after a retrospective analysis found that patients with gout treated with colchicine had a lower rate of myocardial infarction.[1]  Prior studies had demonstrated that inflammation increased patient''s risk of cardiovascular events and the 2019 CANTOS study found improved cardiovascular outcomes with the immunosuppressant  canakinumab. The 2013 Low-Dose Colchicine (LoDoCo) trial randomized patients with stable CAD to colchicine or usual care with improved cardiovascular outcomes particularly ACS. The trial was open label and criticized for its lack of placebo control and blinding to treatment group. Additionally patients were added to the treatment group to replace patients that dropped out of the trial. More recently interest in colchicine''s cardioprotective effects have garnered renewed interest after the 2019 Colchicine Cardiovascular Outcomes Trial (COLCOT) in patients with recent myocardial infarction randomized patients to colchicine vs placebo and found a reduced risk of cardiovascular outcomes.',/wiki/LoDoCo2,,
Among overweight or obese patients with T2DM does moderate weight loss and increased exercise reduce CVD and its complications?,T2DM confers increased risk for development of CVD. Despite the level A recommendation for weight loss in overweight or obese diabetics from the ADA[1] the role of weight loss in long-term reduction of CVD risk in diabetics is unknown. ,/wiki/Look_AHEAD,,
Among patients with HF with LVEF ≤30% and QRS duration ≥130 msec does placement of an ICD with cardiac resynchronization therapy reduce mortality or HF events when compared to ICD placement alone?,The benefit of cardiac resynchronization therapy (CRT) for patients with LVEF ≤35% cardiac dyssynchrony and NYHA class III or IV symptoms was demonstrated by the 2002 MIRACLE and 2005 CARE-HF trials.The role of ICD plus CRT for patients with milder symptoms was less well established.,/wiki/MADIT-CRT,,
In patients with ischemic cardiomyopathy does prophylactic ICD placement improve survival?,The Multicenter Automatic Defibrillator Implantation Trial II (MADIT-II) randomized 1232 post-MI patients with systolic dysfunction (LVEF ≤30%) to prophylactic ICD or conventional medical therapy. Unlike the earlier MADIT-I (1996) and MUSTT (1999) trials MADIT-II did not require electrophysiologic testing for inducible VT prior to enrollment. After a mean follow-up of 20 months the trial was terminated early because prophylactic ICD reduced all-cause mortality (14.2% vs. 19.8%; P=0.016; NNT=18). A post-hoc analysis demonstrated that the mortality reduction appeared to be entirely attributed to a reduction in SCD (3.8% vs. 10.0%; P<0.01)[1].  The reason is not entirely clear but ICD placement was also associated with a higher rate of heart failure (20% vs. 15%).,/wiki/MADIT-II,,
In patients admitted to the hospital with an acute medical illness is short-course rivaroxaban non-inferior to short-course enoxaparin in preventing VTE or its complications without increasing bleeding? Also is extended-course rivaroxaban superior to short-course enoxaparin in preventing VTE or its complications without increasing bleeding?,Guidelines recommend LMWH unfractionated heparin or fondaparinux for the prevention of VTE in hospitalized non-surgical patients at increased risk for clot development.[1] The role of rivaroxaban a direct factor Xa inhibitor is unknown in prevention of VTE and its complications in this population. RECORD1[2] and RECORD3[3] (both published 2008) demonstrated efficacy of short-course rivaroxaban over short-course enoxaparin in prevention of VTE after hip and knee replacements respectively. These interventions were not associated with increased rates of bleeding. Interestingly RECORD2[4] (2008) demonstrated that extended-course rivaroxaban was more effective in preventing VTE than short-course enoxaparin without increasing bleeding rates following hip replacement. The efficacy and safety of rivaroxaban as a VTE prophylactic in acute illness was unknown.,/wiki/MAGELLAN,,
Among high-risk medically ill patients does anticoagulation with rivaroxaban 10 mg PO qday reduce the posthospital discharge rate of symptomatic or fatal venous thromboembolism when compared with placebo?,Patients hospitalized with an acute medical illness may have an increased risk of venous thromboembolism (VTE) that persists for several weeks after hospital discharge.  Anticoagulant prophylaxis reduces VTE during hospitalizations and after high-risk surgeries with rivaroxaban 10 mg PO qday reducing incident VTE in RECORD1[1] and RECORD2[2] for hip and knee replacements respectively.[3] The role for post-hospitalization prophylaxis following higher-risk medical admissions is of unclear clinical utility and guidelines recommend against prolonging the duration of anticoagulation beyond the period of immobilization or hospitalization in view of limited data and unclear net benefit.[3][4],/wiki/MARINER,,
What is the long term mortality benefit and cost effectiveness of screening men 65-74 for abdominal aortic aneurysms? ,Men older than 65 are at a increased risk for death from ruptured AAA.[1] US is a potentantial modality for non-invasive screening for AAA which may reduce mortality through preventive surgical repair. Results of a 1995 pilot study indicated the feasibility of population screening by US.[2] A large clinical trial demonstrating efficacy of the intervention was needed. ,/wiki/MASS,,
In patients with recent ischemic CVA or TIA does clopidogrel plus aspirin reduce recurrent events when compared to clopidogrel alone?,'The evidence-based use of aspirin in cerebrovascular disease was initially based upon early trials such as IST (1997) and Chinese Acute Stroke Trial[1] (1997) which demonstrated a clear benefit of the antiplatelet agent in secondary prevention of ischemic CVA and TIA. This was confirmed in the 2002 Antithrombotic Trialists'' Collaboration meta-analysis.[2] The use of clopidogrel was initially based upon extrapolation from studies of CAD and then from direct study in the CAPRIE trial (1996). CURE (2001) and CREDO[3] (2002) demonstrated a clear benefit of combination therapy with aspirin plus clopidogrel compared to aspirin alone in CAD but combination therapy had not yet been studied in cerebrovascular disease. MATCH sought to compare combination therapy with aspirin plus clopidogrel to clopidogrel alone in secondary prevention of ischemic stroke/TIA.',/wiki/MATCH,,
In patients with HFrEF and NYHA class II-IV symptoms does metoprolol succinate reduce morbidity and mortality?,The original CIBIS trial (1994)[1] demonstrated a functional benefit for patients with systolic dysfunction with treatment with the beta blocker bisoprolol. The role of beta blockers in mortality reduction was unclear. ,/wiki/MERIT-HF,,
Among patients with symptomatic mild-to-moderate osteoarthritis and meniscal tear does arthroscopic partial meniscectomy improve symptoms when compared to physical therapy alone?,Radiographic evidence of osteoarthritis (OA) and meniscal tears are both common in the adult population and are often asymptomatic. The Moseley Trial (2002) demonstrated no difference between arthoscopic debridement and a sham surgery in individuals with symptomatic knee OA. The efficacy of meniscal surgery compared to physical therapy (PT) in individuals with knee pain and radiographic evidence of meniscal tear and osteoarthritis is unclear.   ,/wiki/METEOR,,
Among patients with flail mitral regurgitation but without a class I indication for surgical correction is early surgery associated with improved survival compared to medical management?,The 2006 ACC/AHA guidelines[1] provide a class I recommendation for MV surgery in two groups of chronic severe MR patients: 1) those with symptoms of heart failure and 2) those without symptoms but with mild-moderate LV dysfunction. The role of surgery for patients without these indications has been debated.,/wiki/MIDA,,
Among critically ill patients with hypoactive or hyperactive delirium does administration of the antipsychotic medications haloperidol or ziprasidone improve the number of days alive without delirium or coma when compared to placebo?,The incidence of delirium within the ICU has been cited to be 30% however can reach much higher incidences in certain ICU populations particularly in conjunction with organ failure or mechanical ventilation.[1] Delirium similar to non-ICU patients is associated with increased mortality prolonged mechanical ventilation and prolonged ICU stays.[2] Many trials to date have looked at the use of antipsychotic therapy in both prevention of delirium as well as reducing the length of delirium.HOPE-ICU (2013) tested haloperidol a typical antipsychotic in preventing delirium without evidence of shortening duration or incidence of delirium.[3] A pilot study by Devlin et al. (2010) identified the potential for the atypical antipsychotic quetiapine to reduce duration of delirium and increase rates of hospital discharge when added to haloperidol.[4] Given these varied findings the role of antipsychotic therapy in management of ICU-related delirium was unclear. ,/wiki/MIND-USA,,
In patients with UA/NSTEMI does early treatment with atorvastatin reduce rates of early CV events when compared with placebo?,The use of statins had previously been shown to reduce mortality from chronic cardiovascular disease. This trial aimed to evaluate whether early initiation of therapy may also be of benefit.,/wiki/MIRACL,,
Among patients with empyema does the combination of tPA and DNAse improve resolution of pleural loculation as evidenced by radiographic pleural fluid density?,'Parapneumonic effusions and empyema are significant sources of morbidity and mortality. Antibiotics have difficulty penetrating the fibrinopurulent phase of pleural space infections. Video assisted thoracoscopic surgery (VATS) with decortication and washout are the gold standard for suitable candidates however the procedure is invasive and many patients are not operative candidates. The investigation of intrapleural agents therefore are of interest as an additional treatment modality. However the 2005 MIST1 study[1] found no clinical benefit from infusion of the fibrinolytic streptokinase into the infected pleural fluid collection. Streptokinase''s fibrinolytic activity is systemic while tPA''s fibrinolysis tends to be more localized to thrombi which might drive more effective lysis of pathological thrombi which might be advantageous in degrading the loculations in pleural infections.[2] DNase degrades DNA and reduces the viscosity of fluids with breakdown products of bacteria.[3] Use of a DNase agent might also improve locular breakdown in pleural infections without compounding the bleeding risk associated with thrombolytics. Whether either of these agents improves outcomes in pleural infections was unresolved.',/wiki/MIST2,,
Among patients receiving oral antibiotics for primary or recurrent C. difficile infection does actoxumab or bezlotoxumab reduce the rate of recurrent infection as compared to placebo.?,Clostridium difficile infection (CDI) may recur in up to one-third of patients after completing initial therapy.[1][2] Different therapies have been evaluated for the prevention of CDI recurrence including probiotics fidaxomicin and fecal microbiota transplantation (FMT). Fidaxomicin has been shown to reduce recurrence rate as compared to vancomycin (16.9% vs 29.2%; P = 0.048).[3] However its cost-effectiveness has been debated.[4] As discussed in a recent review the recurrence rate associated with fidaxomicin treatment remains suboptimal (>10%).[5] Recent reviews and guidelines have concluded that there are insufficient data to recommend the use of probiotics for prevention of recurrent CDI.[6][7][8][9] FMT has also demonstrated efficacy in reducing recurrence rates however many questions including administration route and candidate selection remains to be addressed.[10][11][5] The annual economic burden of CDI is estimated to be more than $496 million in the US.[12] A study in 2014 also showed that C. difficile was the most common pathogen isolated in healthcare-associated infections (12.1%).[13] Given the burden of CDI there is an urgent need to identify effective additional effective therapies for its secondary prevention.,/wiki/MODIFY_I_and_II,,
In patients with advanced heart failure refractory to medical management referred for durable left ventricular assist device (LVAD) placement is a magnetically levitated centrifugal-flow device superior to an axial-flow device with regard to reoperation for device malfunction or disabling stroke?,"LVADs are proven effective both for providing temporary support to patients awaiting cardiac transplant (termed ""bridge to transplant"") as well as durably improving survival and quality of life in patients who are not transplant candidates (termed ""destination therapy"" see REMATCH and HEARTMATE II). Since the original REMATCH trial LVAD technology has improved with transition from first-generation pulsatile-flow devices to second-generation continuous-flow devices which were shown in HEARTMATE II to be associated with fewer mechanical failures and disabling strokes. Nevertheless even second-generation continuous flow devices are susceptible to mechanical complications such as pump thrombosis which often results in need for reoperation. Magnetically levitated centrifugal-flow devices may improve upon the earlier axial-flow design by using a magnetic induction motor to generate flow centrifugally allowing for wide blood-flow paths and intrinsic pulsatility factors that may reduce pump thrombosis rates. In a 6-month analysis of the HeartMate III centrifugal-flow device there was an absence of pump thrombosis compared to a 10.1% rate observed with second-generation axial-flow LVADs.[1] Whether this difference persists in longer-term follow up or is associated with clinical events remained unproven.",/wiki/MOMENTUM_3,,
Among patients with submassive PE does low-dose tPA reduce the incidence of pulmonary hypertension or recurrent PE when compared to anticoagulation alone?,Thrombolysis with intravenous tPA is a standard treatment for acute massive PE.[1] However among patients with submassive PE namely those who are hemodynamically stable but have signs of RV dysfunction the selection of patients who may benefit from thrombolysis remains elusive. tPA has rarely been used in the latter population where the benefit of thrombolysis has not clearly been demonstrated to outweigh the risk of major bleeding. The MAPPET-3 trial[2] (2002) compared heparin therapy with either tPA or placebo in patients with submassive PE and found that tPA reduced a composite endpoint of in-hospital all-cause mortality or clinical decompensation requiring further intervention. However no survival benefit was seen an observation attributed in part to the excess in bleeding risk associated with tPA. Low-dose tPA may reduce this bleeding risk while retaining efficacy although this hypothesis had not been formally tested.,/wiki/MOPETT,,
In patients with knee osteoarthritis (OA) does arthroscopic debridement or lavage reduce knee pain at two years?,Arthroscopic interventions have been widely used for the treatment of symptomatic knee OA but the practice is controversial because its efficacy has not been clearly established in clinical trials.[1] The Moseley Trial randomized 180 predominantly white male patients with symptomatic and radiographic evidence of knee OA to arthroscopic debridement arthroscopic lavage or sham arthroscopy performed by a single orthopedic surgeon in Texas.  At two years there was no difference in pain and function between the arthroscopic interventions and sham surgery. ,/wiki/Moseley_Trial,,
Among patients with pancreatic adenocarcinoma being treated with first-line chemotherapy for metastatic disease does gemcitabine plus nab-paclitaxel prolong overall survival compared to gemcitabine alone?,'Pancreatic cancer is an aggressive malignancy and patients with metastatic disease have an overall dismal prognosis. Traditional chemotherapeutic therapies may be ineffective because of the hypovascular and desmoplastic nature of the tumor''s stroma.[1] For many years a standard of care was elusive; eventually gemcitabine was compared to 5-fluorouracil (5FU) and demonstrated an overall survival advantage (5.6 vs. 4.4 months).[2] Improved outcomes were seen with leucovorin 5-fluorouracil irinotecan and oxaliplatin (FOLFIRINOX) in the PRODIGE 4 ACCORD 11 study which resulted in an overall survival benefit when compared to gemcitabine monotherapy (11.1 vs. 6.8 months; P <0.001).[3] This regimen was found to be fairly toxic and subsequent efforts sought to reduce toxicity while improving on the efficacy of gemcitabine monotherapy. ',/wiki/MPACT,,
In patients with large proximal anterior circulation strokes does intra-arterial (IA) intervention in addition to usual care offer improved neurological outcomes? ,Large artery occlusions of the proximal anterior circulation (involving the ICA M1 M2 A1 A2) accounts for about one-third of anterior ischemic strokes.[1] However conventional IV tissue plasminogen activator (tPA) therapy is able to achieve recanalization in perhaps only a fifth of patients with proximal arterial occlusions and perhaps only in under 5% of patients with ICA occlusions.[2] Unfortunately the remainder of these patients typically go on to have poor functional prognoses. ,/wiki/MR_CLEAN,,
In patients with acute ischemic stroke does the presence of viable ischemic brain tissue on neuroimaging identify those most likely to benefit from endovascular thrombectomy?,Few studies have provided support for penumbral-imaging selection for the treatment of acute ischemic stroke (including DEFUSE[1] DEFUSE2[2] and EPITHET[3]). However there was no RCT showing that patients selected for revascularization on the basis of penumbral-imaging pattern had better clinical outcomes than patients treated medically or those with unfavorable penumbral imaging pattern.,/wiki/MR_RESCUE,,
In high-risk male patients does a multi-factor intervention program decrease mortality from coronary heart disease (CHD) as compared to usual medical care?,"In the 1970s as it still is today[1] CVD (including CHD) was a leading cause of death among US adults. The seminal Framingham Heart Study identified the ""conventional"" risk factors for CHD including smoking elevated cholesterol and elevated BP.[2] Whether modifying these risk factors reduced CHD deaths was unknown. The Multiple Risk Factor Intervention Trial (MRFIT) was a seminal clinical trial in CHD risk prevention that randomized 12866 men between 35 to 57 years old with high risk of death from CHD to receive a multi-factor ""special intervention"" (SI) program or usual medical care. Participants received 1. Smoking cessation counseling 2. BP lowering with antihypertensives and 3. Cholesterol lowering through dietary counseling. The 7-year results did not show any benefit of the multi-factor intervention program on mortality from CHD as compared to usual medical care possibly because of lower-than-expected CHD events. Further analyses later found a reduction in a combined fatal and non-fatal CHD events. ",/wiki/MRFIT,,
